{
  "$schema": "../schemas/dependencies-schema.json",
  "feature_id": "feature-user-auth",
  "updated_at": "2024-01-15T10:30:00Z",

  "depends_on": [],

  "blocks": [
    {
      "feature_id": "feature-notifications",
      "reason": "Notifications require authenticated user context",
      "required_phase": "implementation_complete",
      "blocking_since": "2024-01-12T11:00:00Z"
    },
    {
      "feature_id": "feature-user-preferences",
      "reason": "Preferences need user authentication",
      "required_phase": "testing_complete"
    }
  ],

  "shared_resources": [
    {
      "resource": "prisma/schema.prisma",
      "shared_with": ["feature-user-preferences"],
      "conflict_risk": "medium",
      "coordination_required": true
    },
    {
      "resource": "src/middleware.ts",
      "shared_with": [],
      "conflict_risk": "low"
    }
  ],

  "external_dependencies": {
    "packages": [
      {
        "name": "next-auth",
        "version": "^4.24.0",
        "added": true,
        "reason": "Authentication framework"
      },
      {
        "name": "@auth/prisma-adapter",
        "version": "^1.0.0",
        "added": true,
        "reason": "Prisma adapter for NextAuth"
      }
    ],
    "services": [
      {
        "name": "Google OAuth",
        "type": "oauth_provider",
        "required": true,
        "configured": true
      },
      {
        "name": "GitHub OAuth",
        "type": "oauth_provider",
        "required": true,
        "configured": true
      }
    ],
    "environment_variables": [
      "NEXTAUTH_SECRET",
      "NEXTAUTH_URL",
      "GOOGLE_CLIENT_ID",
      "GOOGLE_CLIENT_SECRET",
      "GITHUB_CLIENT_ID",
      "GITHUB_CLIENT_SECRET"
    ]
  },

  "merge_requirements": {
    "order": 1,
    "can_merge_independently": true,
    "requires_features": [],
    "required_before": ["feature-notifications", "feature-user-preferences"]
  }
}
